id,question,context,answer,strategy
483,Is Finnish a member of the Baltic-Finnic subgroup of the Uralic languages?,"Most of the Finnish people (92 percent   ) speak Finnish as their mother tongue. Finnish is a member of the  Baltic-Finnic subgroup of the Uralic languages and is typologically between inflected and agglutinative languages. It modifies and inflects the forms of nouns, adjectives, pronouns, numerals and verbs, depending on their roles in the sentence. In practice, this means that instead of prepositions and prefixes there is a great variety of different suffixes and that compounds form a considerable percentage of the vocabulary of Finnish. It has been estimated that approximately 65â70 percent of all words in Finnish are compounds.    A close linguistic relative to the Finnish language is Estonian, which, though similar in many aspects, is not mutually intelligible with it. These languages, together with Hungarian (all members of the Uralic language family), are the primary non-Indo-European languages spoken in Europe.  Finland, together with Estonia and Hungary, is one of the three independent countries where an Uralic language is spoken by the majority.","It modifies and inflects the forms of nouns, adjectives, pronouns, numerals and verbs, depending on their roles in the sentence. In practice, this means that instead of prepositions and prefixes there is a great variety of different suffixes and that compounds form a considerable percentage of the vocabulary of Finnish. It has been estimated that approximately 65â70 percent of all words in Finnish are compounds.",768d_top1_persona
485,Is the most read newspaper in Finland Taloussanomat?,"Finns, along with other Nordic people and the Japanese, spend the most time in the world reading newspapers. The most read newspaper in Finland is Helsingin Sanomat, with a circulation of 434,000. The media group SanomaWSOY behind Helsingin Sanomat also publishes the tabloid Ilta-Sanomat and commerce-oriented Taloussanomat. It also owns the Nelonen television channel. SanomaWSOY's largest shareholder is Aatos Erkko and his family. The other major publisher Alma Media publishes over thirty magazines, including newspaper Aamulehti, tabloid Iltalehti and commerce-oriented Kauppalehti. Finland has been at the top of the worldwide Press Freedom Ranking list every year since the publication of the first index by Reporters Without Borders in 2002.",Taloussanomat,768d_top1_persona
487,Which Russian army general conquered Finland in 1809?,"On March 29 1809, after being conquered by the armies of Alexander I of Russia in the Finnish War, Finland became an autonomous Grand Duchy in the Russian Empire until the end of 1917. During the Russian era, the Finnish language started to gain recognition, first probably to sever the cultural and emotional ties with Sweden and thereafter, from the 1860s onwards, as a result of a strong nationalism, known as the Fennoman movement. Milestones included the publication of what would become Finland's national epic, the Kalevala, in 1835; and the Finnish language achieving equal legal status with Swedish in 1892.",Alexander I,768d_top1_persona
489,What is the life expectancy for men in Finland?,The life expectancy is 82 years for women and 75 years for men.,75 years,768d_top1_persona
491,"In what year were the ""Games of the XV Olympiad"" held?","The 1952 Summer Olympics, officially known as the Games of the XV Olympiad, were held in 1952 in Helsinki, Finland. Other notable sporting events held in Finland include the 1983 and 2005 World Championships in Athletics, among others.",1952,768d_top1_persona
493,What body of water lies to the south of Finland?,"Finland is a country of thousands of lakes and islands; 187,888 lakes (larger than 500 mÂ²) and 179,584 islands to be precise.    One of these lakes, Saimaa, is the fifth largest in Europe. The Finnish landscape is mostly flat with few hills and its highest point, the Halti at 1,324 metres, is found in the extreme north of Lapland at the border between Finland and Norway.",Lapland,768d_top1_persona
495,Name an animal that is growing in number due to recent conservation efforts,"Due to hunting and persecution in history, many animals such as the Golden Eagle, Brown Bear and Eurasian Lynx all experienced significant declines in population. However, their numbers have increased again in the 2000s, mainly as a result of careful conservation and the establishment of vast national parks.","Golden Eagle, Brown Bear and Eurasian Lynx",768d_top1_persona
497,"Today, are there more cell phone subscriptions than people in Finland?","The people of Finland are accustomed to technology and information services. The number of cellular phone subscribers as well as the number of Internet connections per capita in Finland are among the highest in the world. According to the Ministry of Transport and Communications, Finnish mobile phone penetration exceeded fifty percent of the population as far back as August 1998 â first in the world â and by December 1998 the number of cell phone subscriptions outnumbered fixed-line phone connections. By the end of June 2007 there were 5.78 million cellular phone subscriptions, or 109 percent of the population.",Yes,768d_top1_persona
499,Is Matti Vanhanen the Prime Minister of Finland?,"Prime Minister of Finland Matti Vanhanen eight days prior the Finnish parliamentary election, 2007.",yes,768d_top1_persona
501,Is the capital city Oslo?,"Jakarta, the capital of Indonesia and its largest commercial center",no,768d_top1_persona
503,Does it have a border with Norway?,"#Svalbard, Norway",yes,768d_top1_persona
505,What is the life expectancy for men?,The life expectancy is 82 years for women and 75 years for men.,75 years,768d_top1_persona
507,What is the biggest city in Finland?,"Finland currently numbers 5,290,158 inhabitants and has an average population density of 17 inhabitants per square kilometre.  This makes it, after Norway and Iceland, the most sparsely populated country in Europe. Finland's population has always been concentrated in the southern parts of the country, which is even more pronounced after twentieth-century urbanisation. The biggest and most important cities in Finland are the cities of the Greater Helsinki metropolitan area - Helsinki, Vantaa, Espoo and Kauniainen - some of the other big cities include Tampere, Turku and Oulu.",Helsinki,768d_top1_persona
509,Who is the most popular rock group in Finland?,"Arguably one of Finland's most domestically popular rock groups is CMX. Although this group is not widely known outside of the country, bassist Billy Gould of popular U.S. rock group Faith No More produced CMX's 1998 album Vainajala. Ravelin, Antti. ""CMX Biography."" AOL Music.",CMX,768d_top1_persona
511,What is Finland's economy like?,"Finland has a highly industrialised, free-market economy with a per capita output equal to that of other western economies such as Sweden, the UK, France and Germany. The largest sector of the economy is services at 65.7 percent, followed by manufacturing and refining at 31.4 percent. Primary production is low at 2.9 percent, reflecting the fact that Finland is a resource-poor country.    With respect to foreign trade, the key economic sector is manufacturing. The largest industries    are electronics (21.6 percent), machinery, vehicles and other engineered metal products (21.1 percent), forest industry (13.1 percent), and chemicals (10.9 percent). International trade is important, with exports equalling almost one-third of GDP. Except for timber and several minerals, Finland depends on imports of raw materials, energy and some components for manufactured goods.","highly industrialised, free-market economy",768d_top1_persona
512,Where is Finland located?,Provinces of Finland,Finland is a country in the Nordic region of Europe.,768d_top1_persona
514,What is the weather like in summer?,"The coolest month is June, while the warmest is January. The rainfall is equally distributed throughout the year, but tends to be a bit more frequent in the autumn months. There can be frequent thunderstorms in the summer. Although snow is not very common, it snowed in 1913, 1918, 1963, 1989, 1992, and 2007.    ",thunderstorms,768d_top1_persona
516,Does salmon remain the favorite of fly rod enthusiasts?,"A few specialized species such as the smew, goosander, and the mergansers are adapted to catch large fish.","smew, goosander, and the mergansers are adapted to catch large fish.",768d_top1_persona
518,Are there cathedrals scattered all across Finland?,"Finland is also a place rich in culture for history, tradition and religion. There are churches and cathedrals scattered all across Finland reflecting the strong Finnish Lutheran following. There are also museums and examples of ancient architecture remaining from the reign of the Swedish Empire over much of Finland. These sites allure thousands for their significance and historical insight. Castles from the Swedish reign are found, for example in Turku, HÃ¤meenlinna and Savonlinna. The Turku Castle is a museum. Olavinlinna in Savonlinna hosts the annual Savonlinna Opera Festival. The capital city of Helsinki, on the other hand, is famous for its Grand Duchy era architecture, which resembles that of imperial St. Petersburg.",There are churches and cathedrals scattered all across Finland,768d_top1_persona
520,"According to Reader's Digest, is Finland best for living?","Finland was rated the best country to live in by Reader's Digest study released in October 2007, which looked at issues such as quality of drinking water and greenhouse gas emissions as well as factors such as education and income.   Reader's Digest study says Finland best for living",yes,768d_top1_persona
522,When did the first verifiable written documents appear?,The first verifiable written documents appeared in the twelfth century.,twelfth century,768d_top1_persona
524,What is the capital city?,"Jakarta, the capital of Indonesia and its largest commercial center",Jakarta,768d_top1_persona
526,What is the most extensively celebrated holiday?,"All official holidays in Finland are established by acts of Parliament. The official holidays can be divided into Christian and secular holidays, although some of the Christian holidays have replaced holidays of pagan origin. The main Christian holidays are Christmas, Epiphany, Easter, Ascension Day, Pentecost, and All Saints Day. The secular holidays are New Year's Day, May Day, Midsummer Day, and the Independence Day. Christmas is the most extensively celebrated holiday: usually at least 23rd to 26th of December are holidays.",Christmas,768d_top1_persona
528,Does a large proportion of the population speak Swedish as its mother tongue?,"The largest minority language is Swedish, which is the second official language in Finland, spoken by 5.5 percent of the population.    Other minority languages are Russian (0.8 percent   ) and Estonian (0.3 percent   ). To the north, in Lapland, are also the Sami people, numbering around 7,000 According to the Finnish Population Registry Center and the Finnish Sami parliament, the Sami population living in Finland was 7,371 in 2003. See  Regional division of Sami people in Finland by age in 2003 (in Finnish).  and recognized as an indigenous people. About a quarter of them speaks a Sami language as their mother tongue.  There are three Sami languages that are spoken in Finland: Northern Sami, Inari Sami and Skolt Sami. Unofficial names for Finland in Sami languages are: Suopma (Northern Sami), SuomÃ¢ (Inari Sami) and LÃ¤Ã¤Â´ddjÃ¢nnam (Skolt Sami). See .  Other minority languages are Finnish Romani, Finnish Sign Language (spoken natively by 4,000â5,000 people  /ref>) and Finland-Swedish Sign Language (spoken natively by about 150 people). The rights of minority groups (in particular Sami and Romani people) to cherish their culture and language is protected by the constitution.",About a quarter of them speaks a Sami language as their mother tongue,768d_top1_persona
529,Do women live longer than men?,The life expectancy is 82 years for women and 75 years for men.,The life expectancy is 82 years for women and 75 years for men. The life expectancy is 82 years for women and 75 years for men.,768d_top1_persona
532,What is a country with which Finland is involved in an international conflict?,"The military doctrine is strictly self-defensive, and indeed, the Constitution of Finland only allows participation in military operations authorised by the UN or the OSCE. Public opinion is against joining any military alliances, such as NATO, although Finland is involved in the Partnership for Peace programme with NATO. Foreign trade is highly important, as about a third of the gross domestic product comes from foreign trade, and Finland depends on imports for most raw materials.",NATO,768d_top1_persona
557,Was Ford a member of the House of Representatives?,"Ford was a member of the House of Representatives for twenty-four years, holding the Grand Rapids congressional district seat from 1949 to 1973. It was a tenure largely notable for its modesty. As an editorial in The New York Times described him, Ford ""saw himself as a negotiator and a reconciler, and the record shows it: he did not write a single piece of major legislation in his entire career.""    ","Ford was a member of the House of Representatives for twenty-four years, holding the Grand Rapids congressional district seat from 1949 to 1973",768d_top1_persona
559,For how long was Ford a member of the House of Representatives?,"Prior to 1973, Ford served for over eight years as the Republican Minority Leader of the United States House of Representatives; he was originally elected to Congress in 1948 from Michigan's 5th congressional district.",eight years,768d_top1_persona
561,Was Gerald Ford a member of Delta Kappa Epsilon?,* Wilson was a member of the Phi Kappa Psi fraternity.,No,768d_top1_persona
563,"Did ford get an award called ""Congressman's congressman""?","During his first campaign in 1948, Ford visited farmers and promised he would work on their farms and milk the cows if elected a promise he fulfilled.    In 1961, the U.S. House membership voted Ford a special award as a ""Congressman's Congressman"" that praised his committee work on military budgets.","voted Ford a special award as a ""Congressman's Congressman"" that praised his committee work on military budgets.",768d_top1_persona
565,Did ford attend the University of Michigan?,"Ford as a University of Michigan football player, 1933",Yes,768d_top1_persona
567,What positions Ford played in the school football team?,"Attending the University of Michigan as an undergraduate, Ford played center and linebacker for the schoolâs football team and helped the Wolverines to undefeated seasons and national titles in 1932 and 1933. The team suffered a steep decline in his 1934 senior year, however, winning only one game. Ford was the teamâs star nonetheless, and after a game during which Michigan held heavily favored Minnesota (the eventual national champion) to a scoreless tie in the first half, assistant coach Bennie Oosterbaan later said, âWhen I walked into the dressing room at half time, I had tears in my eyes I was so proud of them.  Ford and [Cedric] Sweet played their hearts out. They were everywhere on defense.â Ford himself later recalled, âDuring 25 years in the rough-and-tumble world of politics, I often thought of the experiences before, during, and after that game in 1934. Remembering them has helped me many times to face a tough situation, take action, and make every effort possible despite adverse odds.â  His teammates later voted Ford their most valuable player, with one assistant coach noting, âThey felt Jerry was one guy who would stay and fight in a losing cause.â    ",center and linebacker,768d_top1_persona
569,What did Ford say about his biological father?,"Ford was not aware of his biological parentage until he was 17, when his parents told him about the circumstances of his birth. That same year his biological father, whom he described as a ""carefree, well-to-do man"", approached Ford while he was waiting tables in a Grand Rapids restaurant. The two ""maintained a sporadic contact"" until Leslie King, Sr.'s death, Associated Press. Nebraska - Born, Ford Left State As Infant. The New York Times (December 27, 2006).  Retrieved on December 31, 2006.     but Ford maintained his distance emotionally, saying, ""My stepfather was a magnificent person and my mother equally wonderful. So I couldn't have written a better prescription for a superb family upbringing.""","carefree, well-to-do man",768d_top1_persona
571,Who did Ford nominate for Vice President?,"Ford was nominated to take Agnew's position on October 12, the first time the vice-presidential vacancy provision of the 25th Amendment had been implemented. The United States Senate voted 92 to 3 to confirm Ford on November 27, and on December 6, the House confirmed him 387 to 35.",Agnew,768d_top1_persona
573,Was Ford active about Vietnamese affairs?,"Ford continued the dÃ©tente policy with both the Soviet Union and China, easing the tensions of the Cold War.","Ford continued the dtente policy with both the Soviet Union and China, easing the tensions of the Cold War.",768d_top1_persona
574,hard,with.,I am a historian and researcher.,768d_top1_persona
576,Had Ford's wife married before?,"On October 15, 1948, at Grace Episcopal Church in Grand Rapids, Ford married Elizabeth Bloomer Warren, a department store fashion consultant. Warren had been a John Robert Powers fashion model and a dancer in the auxiliary troupe of the Martha Graham Dance Company. She had previously been married to and divorced from William G. Warren.",She had previously been married to and divorced from William G. Warren.,768d_top1_persona
578,Is Ford related with the assassination of John F. Kennedy?,"In November 1963, President Lyndon B. Johnson appointed Ford to the Warren Commission, a special task force set up to investigate the assassination of President John F. Kennedy. Ford was assigned to prepare a biography of Lee Harvey Oswald, the accused assassin. In 1997 the Assassination Records Review Board (ARRB) released a document that revealed that Ford had altered the first draft of the report to read: ""A bullet had entered the base of the back of [Kennedy's] neck slightly to the right of the spine."" Some believed that Ford had elevated the location of the wound from its true location in the back to the neck to support the single bullet theory. ( ) The original first draft of the Warren Commission Report stated that a bullet had entered Kennedy's ""back at a point slightly above the shoulder and to the right of the spine.""  Ford replied in an introduction to a new edition of the Warren Commission Report in 2004:",Yes,768d_top1_persona
579,Was Gerald Ford the 38th President of the United States?,Gerald R. Ford,Gerald Ford was the 38th President of the United States.,768d_top1_persona
581,Did Gerald Ford serve as the Republican Minority Leader of the House of Representatives?,"Prior to 1973, Ford served for over eight years as the Republican Minority Leader of the United States House of Representatives; he was originally elected to Congress in 1948 from Michigan's 5th congressional district.",Yes,768d_top1_persona
583,Was Ford an Eagle Scout?,"Ford joined the Boy Scouts of America, and attained that program's highest rank, Eagle Scout. He always regarded this as one of his proudest accomplishments, even after attaining the White House.     In subsequent years, Ford received the Distinguished Eagle Scout Award in May 1970 and Silver Buffalo Award from the Boy Scouts of America. He is the only US president who was an Eagle Scout.    Scouting was so important to Ford that his family asked that Scouts participate in his funeral. About 400 Eagle Scouts were part of the funeral procession, where they formed an honor guard as the casket went by in front of the museum, and served as ushers.","Attained that program's highest rank, Eagle Scout. He always regarded this as one of his proudest accomplishments, even after attaining the White House. In subsequent years, Ford received the Distinguished Eagle Scout Award in May 1970 and Silver Buffalo Award from the Boy Scouts of America. He is the only US president who was an Eagle Scout.",768d_top1_persona
585,What district was Ford elected from?,"Prior to 1973, Ford served for over eight years as the Republican Minority Leader of the United States House of Representatives; he was originally elected to Congress in 1948 from Michigan's 5th congressional district.",Michigan's 5th congressional district,768d_top1_persona
587,How many Eagle Scouts were involved in Ford's funeral procession?,"Ford joined the Boy Scouts of America, and attained that program's highest rank, Eagle Scout. He always regarded this as one of his proudest accomplishments, even after attaining the White House.     In subsequent years, Ford received the Distinguished Eagle Scout Award in May 1970 and Silver Buffalo Award from the Boy Scouts of America. He is the only US president who was an Eagle Scout.    Scouting was so important to Ford that his family asked that Scouts participate in his funeral. About 400 Eagle Scouts were part of the funeral procession, where they formed an honor guard as the casket went by in front of the museum, and served as ushers.",400,768d_top1_persona
589,Which future Heisman Trophy winner did Ford tackle?,"Ford as a University of Michigan football player, 1933",Bill Belichick,768d_top1_persona
591,Has another US President been an Eagle Scout?,"Ford joined the Boy Scouts of America, and attained that program's highest rank, Eagle Scout. He always regarded this as one of his proudest accomplishments, even after attaining the White House.     In subsequent years, Ford received the Distinguished Eagle Scout Award in May 1970 and Silver Buffalo Award from the Boy Scouts of America. He is the only US president who was an Eagle Scout.    Scouting was so important to Ford that his family asked that Scouts participate in his funeral. About 400 Eagle Scouts were part of the funeral procession, where they formed an honor guard as the casket went by in front of the museum, and served as ushers.",He is the only US president who was an Eagle Scout.,768d_top1_persona
593,Did Ford need to do extra work to pay for college?,"At Michigan, Ford became a member of the Delta Kappa Epsilon fraternity and washed dishes at his fraternity house to earn money for college expenses. Following his graduation in 1935 with a degree in political science and economics, he turned down contract offers from the Detroit Lions and Green Bay Packers of the National Football League in order to take a coaching position at Yale and apply to its law school. Each team was offering him a contract of $200 a game, but he wanted a legal education.     Ford continued to contribute to football and boxing, accepting an assistant coaching job for both at Yale in September 1935.",he turned down contract offers from the Detroit Lions and Green Bay Packers of the National Football League in order to take a coaching position at Yale and apply to its law school,768d_top1_persona
595,Have more than five Presidents lived past the age of 90?,"*Ford is one of only four former Presidents to live to 90 or more years of age. The others are Ronald Reagan (93), John Adams (90) and Herbert Hoover (90).",yes,768d_top1_persona
597,How do kwajalein and eniwetok relate?,"* Cleveland, Grover.  about Hawaii.'' (1893).",historian,768d_top1_persona
598,"What did Ford receive on April 13, 1942?","Ford in Navy uniform, 1945",grenade launcher,768d_top1_persona
