id,question,context,answer,strategy
0,Was Abraham Lincoln the sixteenth President of the United States?,"Abraham Lincoln (February 12, 1809 â April 15, 1865) was the sixteenth President of the United States, serving from March 4, 1861 until his assassination. As an outspoken opponent of the expansion of slavery in the United States, ""[I]n his short autobiography written for the 1860 presidential campaign, Lincoln would describe his protest in the Illinois legislature as one that 'briefly defined his position on the slavery question, and so far as it goes, it was then the same that it is now."" This was in reference to the anti-expansion sentiments he had then expressed. Doris Kearns Goodwin, Team of Rivals: The Political Genius of Abraham Lincoln (2005) p. 91.  Holzer pg. 232.  Writing of the Cooper Union  speech, Holzer notes, ""Cooper Union proved a unique confluence of political culture, rhetorical opportunity, technological innovation, and human genius, and it brought Abraham Lincoln to the center stage of American politics at precisely the right time and place, and with precisely the right message: that slavery was wrong, and ought to be confined to the areas where it already existed, and placed on the 'course of ultimate extinction... .'""  Lincoln won the Republican Party nomination in 1860 and was elected president later that year. During his term, he helped preserve the United States by leading the defeat of the secessionist Confederate States of America in the American Civil War. He introduced measures that resulted in the abolition of slavery, issuing his Emancipation Proclamation in 1863 and promoting the passage of the Thirteenth Amendment to the Constitution in 1865.","Yes, Abraham Lincoln (February 12, 1809 â April 15, 1865) was the sixteenth President of the United States, serving from March 4, 1861 until his assassination. As an outspoken opponent of the expansion of slavery in the United States, ""[I]n his short autobiography written for the 1860 presidential campaign, Lincoln would describe his protest in the Illinois legislature as one that 'briefly defined his position on the slavery question, and so far as it goes, it was then the same that it is now."" This was in reference to the anti-expansion sentiments he had then expressed.",768d_top1_persona
2,Did Lincoln sign the National Banking Act of 1863?,"Lincoln believed in the Whig theory of the presidency, which left Congress to write the laws while he signed them, vetoing only those bills that threatened his war powers. Thus, he signed the Homestead Act in 1862, making millions of acres of government-held land in the West available for purchase at very low cost. The Morrill Land-Grant Colleges Act, also signed in 1862, provided government grants for agricultural universities in each state. The Pacific Railway Acts of 1862 and 1864 granted federal support for the construction of the United States' First Transcontinental Railroad, which was completed in 1869. Other important legislation involved economic matters, including the first income tax and higher tariffs. Also included was the creation of the system of national banks by the National Banking Acts of 1863, 1864, and 1865, which allowed the creation of a strong national financial system.  Congress created and Lincoln approved the Department of Agriculture in 1862, although that institution would not become a Cabinet-level department until 1889.",Yes,768d_top1_persona
4,Did his mother die of pneumonia?,"He died at 11:10 p.m. on March 8, 1874, of the after-effects of a stroke.  His last words were alleged to be, upon being fed some soup, ""the nourishment is palatable.""  On January 7 each year, a ceremony is held at his grave site in the Forest Lawn Cemetery in Buffalo.",She died of the after-effects of a stroke.,768d_top1_persona
6,How many long was Lincoln's formal education?,"Lincoln's formal education consisted of about 18 months of schooling. Largely self-educated, he read every book he could get his hands on, once walking.  just to borrow one  While his favorite book was The Life of George Washington, Lincoln mastered the Bible, Shakespeare, and English and American history, and developed a plain writing style that puzzled audiences more used to grandiose rhetoric. He was also a talented local wrestler and skilled with an ax; some rails he had allegedly split in his youth were exhibited at the 1860 Republican National Convention, as the party celebrated the poor-boy-made-good theme. Lincoln avoided hunting and fishing because he did not like killing animals, even for food. Though he was unusually tall at  , 4 inches and strong, Lincoln spent so much time reading that some neighbors suspected he must be doing it to avoid strenuous manual labor.",18 months,768d_top1_persona
8,When did Lincoln begin his political career?,"Lincoln began his political career in 1832, at age 23, with an unsuccessful campaign for the Illinois General Assembly, as a member of the Whig Party.  He ran eighth in a field of 13 candidates.  The centerpiece of his platform was the undertaking of navigational improvements on the Sangamon River. He believed that this would attract steamboat traffic, which would allow the sparsely populated, poorer areas along the river to flourish.",1832,768d_top1_persona
10,What did The Legal Tender Act of 1862 establish?,"The Legal Tender Act of 1862 established the United States Note, the first paper currency in United States history.  This was done to increase the money supply to pay for fighting the war.","The Legal Tender Act of 1862 established the United States Note, the first paper currency in United States history.",768d_top1_persona
12,Who suggested Lincoln grow a beard?,"While Lincoln is usually portrayed bearded, he first grew a beard in 1860 at the suggestion of 11-year-old Grace Bedell",Grace Bedell,768d_top1_persona
14,When did the Gettysburg address argue that America was born?,"In his Gettysburg Address Lincoln redefined the American nation, arguing that it was born not in 1789 but in 1776, ""conceived in Liberty, and dedicated to the proposition that all men are created equal."" He declared that the sacrifices of battle had rededicated the nation to the propositions of democracy and equality, ""that this nation shall have a new birth of freedom â and that government of the people, by the people, for the people, shall not perish from the earth."" By emphasizing the centrality of the nation, he rebuffed the claims of state sovereignty. While some critics say Lincoln moved too far and too fast,  H.L. Mencken said ""It is difficult to imagine anything more untrue. The Union soldiers in the battle actually fought against self-determination; it was the Confederates who fought for the right of their people to govern themselves."" Mencken did not mention the right of self-determination rights for blacks.   they agree that he dedicated the nation to values that marked ""a new founding of the nation.""  Wills (1992) p. 39.",1776,768d_top1_persona
16,Did Lincoln beat John C. Breckinridge in the 1860 election?,"On November 6, 1860, Lincoln was elected as the 16th President of the United States, beating Democrat Stephen A. Douglas, John C. Breckinridge of the Southern Democrats, and John Bell of the new Constitutional Union Party. He was the first Republican president, winning entirely on the strength of his support in the North: he was not even on the ballot in nine states in the South, and won only 2 of 996 counties in the other Southern states. Lincoln gained 1,865,908 votes (39.9% of the total), for 180 electoral votes; Douglas, 1,380,202 (29.5%) for 12 electoral votes; Breckenridge, 848,019 (18.1%) for 72 electoral votes; and Bell, 590,901 (12.5%) for 39 electoral votes. There were fusion tickets in some states, but even if his opponents had combined in every state, Lincoln had a majority vote in all but two of the states in which he won the electoral votes and would still have won the electoral college and the election.",Yes,768d_top1_persona
18,Was Abraham Lincoln the first President of the United States?,"Abraham Lincoln (February 12, 1809 â April 15, 1865) was the sixteenth President of the United States, serving from March 4, 1861 until his assassination. As an outspoken opponent of the expansion of slavery in the United States, ""[I]n his short autobiography written for the 1860 presidential campaign, Lincoln would describe his protest in the Illinois legislature as one that 'briefly defined his position on the slavery question, and so far as it goes, it was then the same that it is now."" This was in reference to the anti-expansion sentiments he had then expressed. Doris Kearns Goodwin, Team of Rivals: The Political Genius of Abraham Lincoln (2005) p. 91.  Holzer pg. 232.  Writing of the Cooper Union  speech, Holzer notes, ""Cooper Union proved a unique confluence of political culture, rhetorical opportunity, technological innovation, and human genius, and it brought Abraham Lincoln to the center stage of American politics at precisely the right time and place, and with precisely the right message: that slavery was wrong, and ought to be confined to the areas where it already existed, and placed on the 'course of ultimate extinction... .'""  Lincoln won the Republican Party nomination in 1860 and was elected president later that year. During his term, he helped preserve the United States by leading the defeat of the secessionist Confederate States of America in the American Civil War. He introduced measures that resulted in the abolition of slavery, issuing his Emancipation Proclamation in 1863 and promoting the passage of the Thirteenth Amendment to the Constitution in 1865.","Abraham Lincoln (February 12, 1809 â April 15, 1865) was the sixteenth President of the United States, serving from March 4, 1861 until his assassination.",768d_top1_persona
20,Did Lincoln start his political career in 1832?,"Lincoln began his political career in 1832, at age 23, with an unsuccessful campaign for the Illinois General Assembly, as a member of the Whig Party.  He ran eighth in a field of 13 candidates.  The centerpiece of his platform was the undertaking of navigational improvements on the Sangamon River. He believed that this would attract steamboat traffic, which would allow the sparsely populated, poorer areas along the river to flourish.",Yes,768d_top1_persona
22,Did Lincoln ever represent Alton & Sangamon Railroad?,"By the mid-1850s, Lincoln's caseload focused largely on the competing transportation interests of river barges and railroads. In one prominent 1851 case, he represented the Alton & Sangamon Railroad in a dispute with a shareholder, James A. Barret. Barret had refused to pay the balance on his pledge to the railroad on the grounds that it had changed its originally planned route. Lincoln argued that as a matter of law a corporation is not bound by its original charter when that charter can be amended in the public interest, that the newer route proposed by Alton & Sangamon was superior and less expensive, and that accordingly, the corporation had a right to sue Barret for his delinquent payment. He won this case, and the decision by the Illinois Supreme Court was eventually cited by several other courts throughout the United States. Donald, (1995) ch. 6.","In one prominent 1851 case, he represented the Alton & Sangamon Railroad in a dispute with a shareholder, James A. Barret. Barret had refused to pay the balance on his pledge to the railroad on the grounds that it had changed its originally planned route. Lincoln argued that as a matter of law a corporation is not bound by its original charter when that charter can be amended in the public interest, that the newer route proposed by Alton & Sangamon was superior and less expensive, and that accordingly, the corporation had a right to sue Barret for his delinquent payment. He won this case, and the decision by the Illinois Supreme Court was eventually cited by several other courts throughout the United States.",768d_top1_persona
24,Which county was Lincoln born in?,"Abraham Lincoln was born on February 12, 1809, to Thomas Lincoln and Nancy Hanks, two uneducated farmers. Lincoln was born in a one-room log cabin on the   Sinking Spring Farm, in southeast Hardin County, Kentucky (now part of LaRue County). This area was at the time considered the ""frontier."" The name ""Abraham"" was chosen to commemorate his grandfather, who was killed in an American Indian raid in 1786. Donald (1995) p 21  His elder sister, Sarah Lincoln, was born in 1807; a younger brother, Thomas Jr, died in infancy. It is sometimes debated whether Lincoln had Marfan syndrome, an autosomal dominant disorder of the connective tissue characterized by long limbs and great physical stature.  Marfan syndrome: Introduction Aug 1, 2006","Hardin County, Kentucky",768d_top1_persona
26,When did Lincoln first serve as President?,"Abraham Lincoln (February 12, 1809 â April 15, 1865) was the sixteenth President of the United States, serving from March 4, 1861 until his assassination. As an outspoken opponent of the expansion of slavery in the United States, ""[I]n his short autobiography written for the 1860 presidential campaign, Lincoln would describe his protest in the Illinois legislature as one that 'briefly defined his position on the slavery question, and so far as it goes, it was then the same that it is now."" This was in reference to the anti-expansion sentiments he had then expressed. Doris Kearns Goodwin, Team of Rivals: The Political Genius of Abraham Lincoln (2005) p. 91.  Holzer pg. 232.  Writing of the Cooper Union  speech, Holzer notes, ""Cooper Union proved a unique confluence of political culture, rhetorical opportunity, technological innovation, and human genius, and it brought Abraham Lincoln to the center stage of American politics at precisely the right time and place, and with precisely the right message: that slavery was wrong, and ought to be confined to the areas where it already existed, and placed on the 'course of ultimate extinction... .'""  Lincoln won the Republican Party nomination in 1860 and was elected president later that year. During his term, he helped preserve the United States by leading the defeat of the secessionist Confederate States of America in the American Civil War. He introduced measures that resulted in the abolition of slavery, issuing his Emancipation Proclamation in 1863 and promoting the passage of the Thirteenth Amendment to the Constitution in 1865.","February 12, 1809 â April 15, 1865",768d_top1_persona
28,Who assassinated Lincoln?,"The assassination of Abraham Lincoln. From left to right: Henry Rathbone, Clara Harris, Mary Todd Lincoln, Abraham Lincoln and John Wilkes Booth",Henry Rathbone,768d_top1_persona
30,Did Lincoln win the election of 1860?,"On November 6, 1860, Lincoln was elected as the 16th President of the United States, beating Democrat Stephen A. Douglas, John C. Breckinridge of the Southern Democrats, and John Bell of the new Constitutional Union Party. He was the first Republican president, winning entirely on the strength of his support in the North: he was not even on the ballot in nine states in the South, and won only 2 of 996 counties in the other Southern states. Lincoln gained 1,865,908 votes (39.9% of the total), for 180 electoral votes; Douglas, 1,380,202 (29.5%) for 12 electoral votes; Breckenridge, 848,019 (18.1%) for 72 electoral votes; and Bell, 590,901 (12.5%) for 39 electoral votes. There were fusion tickets in some states, but even if his opponents had combined in every state, Lincoln had a majority vote in all but two of the states in which he won the electoral votes and would still have won the electoral college and the election.","Lincoln gained 1,865,908 votes (39.9% of the total), for 180 electoral votes; Douglas, 1,380,202 (29.5%) for 12 electoral votes; Breckenridge, 848,019 (18.1%) for 72 electoral votes; and Bell, 590,901 (12.5%) for 39 electoral votes. There were fusion tickets in some states, but even if his opponents had combined in every state, Lincoln had a majority vote in all but two of the states in which he won the electoral votes and would still have won the electoral college and the election.",768d_top1_persona
32,Who was the general in charge at the Battle of Antietam?,"Lincoln, in top hat, with Allan Pinkerton and Gen. John Alexander McClernand at Antietam.",John Alexander McClernand,768d_top1_persona
34,Why did Lincoln issue the Emancipation Proclamation?,"The Emancipation Proclamation, announced on September 22 and put into effect on January 1, 1863, freed slaves in territories not under Union control. As Union armies advanced south, more slaves were liberated until all of them in Confederate hands (over three million) were freed. Lincoln later said: ""I never, in my life, felt more certain that I was doing right, than I do in signing this paper."" The proclamation made the abolition of slavery in the rebel states an official war goal. Lincoln then threw his energies into passage of the Thirteenth Amendment to permanently abolish slavery throughout the nation. Lincoln addressed the issue of his consistency in an 1864 letter to Albert G. Hodges.  Letter to Albert G. Hodges, April 4, 1864",freed slaves in territories not under Union control,768d_top1_persona
37,Do scholars rank lincoln among the top three presidents?,"Scholars now rank Lincoln among the top three U.S. Presidents, with the majority of those surveyed placing him first. He is noted for his lasting influence on U.S. politics, including a redefinition of republicanism.  As Diggins explains, ""Lincoln presented Americans a theory of history that offers a profound contribution to the theory and destiny of republicanism itself."" John Patrick Diggins, The Lost Soul of American Politics: Virtue, Self-interest, and the Foundations of Liberalism (1986) p. 307. Foner (1970) p. 215 noted that, ""Lincoln stressed the moral basis of Republicanism."" Jaffa (2000) p. 399, stresses Lincoln's emphasis on the Declaration of Independence as what Lincoln called the ""sheet anchor"" of republicanism. See also McPherson (1992) pp.61-64.","Scholars now rank Lincoln among the top three U.S. Presidents, with the majority of those surveyed placing him first. He is noted for his lasting influence on U.S. politics, including a redefinition of republicanism.",768d_top1_persona
39,Did lincoln have 18 months of schooling?,"Lincoln's formal education consisted of about 18 months of schooling. Largely self-educated, he read every book he could get his hands on, once walking.  just to borrow one  While his favorite book was The Life of George Washington, Lincoln mastered the Bible, Shakespeare, and English and American history, and developed a plain writing style that puzzled audiences more used to grandiose rhetoric. He was also a talented local wrestler and skilled with an ax; some rails he had allegedly split in his youth were exhibited at the 1860 Republican National Convention, as the party celebrated the poor-boy-made-good theme. Lincoln avoided hunting and fishing because he did not like killing animals, even for food. Though he was unusually tall at  , 4 inches and strong, Lincoln spent so much time reading that some neighbors suspected he must be doing it to avoid strenuous manual labor.","Lincoln mastered the Bible, Shakespeare, and English and American history, and developed a plain writing style that puzzled audiences more used to grandiose rhetoric",768d_top1_persona
41,Was Lincoln chosen as a presidential candidate in 1860?,"On November 6, 1860, Lincoln was elected as the 16th President of the United States, beating Democrat Stephen A. Douglas, John C. Breckinridge of the Southern Democrats, and John Bell of the new Constitutional Union Party. He was the first Republican president, winning entirely on the strength of his support in the North: he was not even on the ballot in nine states in the South, and won only 2 of 996 counties in the other Southern states. Lincoln gained 1,865,908 votes (39.9% of the total), for 180 electoral votes; Douglas, 1,380,202 (29.5%) for 12 electoral votes; Breckenridge, 848,019 (18.1%) for 72 electoral votes; and Bell, 590,901 (12.5%) for 39 electoral votes. There were fusion tickets in some states, but even if his opponents had combined in every state, Lincoln had a majority vote in all but two of the states in which he won the electoral votes and would still have won the electoral college and the election.","Lincoln was elected as the 16th President of the United States, beating Democrat Stephen A. Douglas, John C. Breckinridge of the Southern Democrats, and John Bell of the new Constitutional Union Party.",768d_top1_persona
43,How old was Lincoln in 1816?,Young Abraham Lincoln,1816,768d_top1_persona
45,When was the first photgraph of lincoln taken?,"The first photograph ever taken of Abraham Lincoln, a daguerreotype taken by Shepherd in 1846.",1846,768d_top1_persona
47,How long was Lincoln's legal Career?,"Warned by his law partner, William Herndon, that the damage was mounting and irreparable, Lincoln decided not to run for reelection. In fact, in 1848 he campaigned vigorously for Zachary Taylor, the successful general whose atrocities he had denounced in January. Regardless, his statements were not easily forgotten, and would haunt him during the Civil War. These statements were also held against him when he applied for a position in the new Taylor administration. Instead, Taylor's people offered Lincoln various positions in the remote Oregon Territory, primarily the governorship. Acceptance of this offer would have ended his career in the rapidly growing state of Illinois, so Lincoln declined the position. Returning to Springfield, Lincoln gave up politics for several years and turned his energies to his law practice. During this time, he made many trips on horseback between various counties' courthouses. Beveridge, (1928) 1: 428-33; Donald (1995) p. 140-43.",several years,768d_top1_persona
49,What trail did Lincoln use a Farmers' Almanac in? ,"For several months, Lincoln ran a small store in New Salem, selling tea, coffee, sugar, salt, blue calico, brown muslin, straw hats and whiskey.  Beveridge (1928) 1:127-8  Later, he found work as village postmaster and as a surveyor.","New Salem, selling tea, coffee, sugar, salt, blue calico, brown muslin, straw hats and whiskey",768d_top1_persona
51,Did Abraham Lincoln live in the Frontier?,"Abraham Lincoln was born on February 12, 1809, to Thomas Lincoln and Nancy Hanks, two uneducated farmers. Lincoln was born in a one-room log cabin on the   Sinking Spring Farm, in southeast Hardin County, Kentucky (now part of LaRue County). This area was at the time considered the ""frontier."" The name ""Abraham"" was chosen to commemorate his grandfather, who was killed in an American Indian raid in 1786. Donald (1995) p 21  His elder sister, Sarah Lincoln, was born in 1807; a younger brother, Thomas Jr, died in infancy. It is sometimes debated whether Lincoln had Marfan syndrome, an autosomal dominant disorder of the connective tissue characterized by long limbs and great physical stature.  Marfan syndrome: Introduction Aug 1, 2006","This area was at the time considered the ""frontier.""",768d_top1_persona
53,Did Lincoln's Wife's Family support slavery?,"For some time, Thomas Lincoln was a respected and relatively affluent citizen of the Kentucky back country. He had purchased the Sinking Spring Farm in December of 1808 for $200 cash and assumption of a debt.  The farm site is now preserved as part of Abraham Lincoln Birthplace National Historic Site.  The family belonged to a Baptist church that had seceded from a larger church over the issue of slavery. Though Lincoln was exposed to his parents' anti-slavery sentiment from a very young age, he never joined their church, or any other church for that matter.  As a youth he had little use for religion. Life of Abraham Lincoln, Colonel Ward H. Lamon, 1872 - portions reprinted in  Chapter VIII: Abraham Lincoln, Deist, and Admirer of Thomas Paine, From the book Religious Beliefs of Our Presidents by Franklin Steiner (1936)","The family belonged to a Baptist church that had seceded from a larger church over the issue of slavery. Though Lincoln was exposed to his parents' anti-slavery sentiment from a very young age, he never joined their church, or any other church for that matter.",768d_top1_persona
80,Who is most noted for his contributions to the theory of molarity and molecular weight?,"Lorenzo Romano Amedeo Carlo Avogadro, Count of Quaregna and Cerreto (August 9, 1776 July 9, 1856) was an Italian savant.  He is most noted for his contributions to the theory of molarity and molecular weight. As a tribute to him, the number of elementary entities (atoms, molecules, ions or other particles) in one mole of a substance, 6.02214199x10 23 , is known as Avogadro's number.",Lorenzo Romano Amedeo Carlo Avogadro,768d_top1_persona
83,Who graduated in ecclesiastical law at the early age of 20 and began to practice?,He graduated in ecclesiastical law at  the early age of 20 and began to practice.,He,768d_top1_persona
86,When did he publish another memoria?,Grant writing his memoirs.,1 January 1931,768d_top1_persona
89,When did he become a professor?,"In 1892, he became the third in his family to occupy the physics chair at the MusÃ©um National d'Histoire Naturelle. In 1894, he became chief engineer in the Department of Bridges and Highways.",1894,768d_top1_persona
92,Is it true that he became a professor in 1820?,"He was elected a member of the Royal Society in 1824, appointed director of the laboratory in 1825; and in 1833 he was appointed Fullerian professor of chemistry in the institution for life, without the obligation to deliver lectures.",no,768d_top1_persona
