id,question,context,answer,strategy
1351,"Has it been created with a long term perspective to support the development of Qatar and the wider region , develop local and regional markets , and strengthen the links between the energy based economies and global financial markets ?","The Qatar Financial Centre (QFC) provides financial institutions with a world class financial services platform situated in an economy founded on the development of its hydrocarbons resources. It has been created with a long term perspective to support the development of Qatar and the wider region, develop local and regional markets, and strengthen the links between the energy based economies and global financial markets.","It has been created with a long term perspective to support the development of Qatar and the wider region, develop local and regional markets, and strengthen the links between the energy based economies and global financial markets.",768d_top1_persona
1352,What happened in these positions in english?,"*  Pascal's Memorial in orig. French/Latin and modern English, trans. Elizabeth T. Knuth.","Pascal's Memorial in orig. French/Latin and modern English, trans. Elizabeth T. Knuth.",768d_top1_persona
1353,Can these allophones not occur in these positions in english?,"This happened because the older Anglo-Saxon words ened (= ""duck"") and ende (= ""end"") came to be pronounced the same: other Germanic languages still have similar words for ""duck"" and ""end"": for example, Dutch eend = ""duck"", eind = ""end"", German ente = ""duck"", ende = ""end""; this similarity goes back to Indo-European: compare Latin anas (stem anat-) = ""duck"", Lithuanian antis = ""duck"", Ancient Greek Î½Î·ÏÏÎ±, Î½Î·ÏÏÎ± (nÄssa, nÄtta) = ""duck""; Sanskrit anta = ""end"".",no,768d_top1_persona
1354,"Is -RRB- , officially the state of qatar -LRB- arabic (: : transliterated as dawlat qatar -RRB- , an arab emirate in southwest asia?","In terms of English phonemics, the vowels sound halfway between short u   and broad a  . The q and the t have no direct counterparts, but are closest to the unaspirated allophones of English k and t. However, since these allophones cannot occur in these positions in English, in this context they will sound more like English g and d. So the closest pronunciation, according to English phonemics, to the original Arabic might be   or  . ), officially the State of Qatar (Arabic:  Ø¯ÙÙØ© ÙØ·Ø±   transliterated as Dawlat Qatar), is an Arab emirate in Southwest Asia, occupying the small Qatar Peninsula on the northeasterly coast of the larger Arabian Peninsula. It is bordered by Saudi Arabia to the south; otherwise the Persian Gulf surrounds the state.",yes,768d_top1_persona
1355,Does Romania border Hungary?,"Romania ( ,  ) is a country in Southeastern Europe. It shares a border with Hungary and Serbia to the west, Ukraine and the Republic of Moldova to the northeast, and Bulgaria to the south. Romania has a stretch of sea coast along the Black Sea. It is located roughly in the lower basin of the Danube and almost all of the Danube Delta is located within its territory.","It shares a border with Hungary and Serbia to the west, Ukraine and the Republic of Moldova to the northeast, and Bulgaria to the south",768d_top1_persona
1357,Is Romania a secular state?,"Romania is a secular state, thus having no national religion. The dominant religious body is the Romanian Orthodox Church; its members make up 86.7% of the population according to the 2002 census. Other important religions include Roman Catholicism (4.7%), Protestantism (3.7%), Pentecostal denominations (1.5%) and the Romanian Greek-Catholic Church (0.9%).  Romania also has a historically significant Muslim minority concentrated in Dobrogea, mostly of Turkish ethnicity and numbering 67,500 people.     Romanian Census Website with population by religion  Based on the 2002 census data, there are also 6,179 Jews, 23,105 people who are of no religion and/or atheist, and 11,734 who refused to answer. On December 27, 2006, a new Law on Religion was approved under which religious denominations can only receive official registration if they have at least 20,000 members, or about 0.1 percent of Romania's total population.  Romania President Approves Europe's ""Worst Religion Law""","Romania is a secular state, thus having no national religion",768d_top1_persona
1359,Is the president elected by popular vote?,"Electoral votes by state, 1924.","Electoral votes by state, 1924.",768d_top1_persona
1361,How many counties is Romania divided into?,"Romania is divided into forty-one counties (judeÅ£e), as well as the municipality of Bucharest (BucureÅti) - which is its own administrative unit. Each county is administered by a county council (consiliu judeÅ£ean), responsible for local affairs, as well as a prefect, who is appointed by the central government but cannot be a member of any political party.",forty-one,768d_top1_persona
1363,What is the highest mountain in Romania?,"Romania's terrain is distributed roughly equally between mountainous, hilly and lowland territories. The Carpathian Mountains dominate the center of Romania, with fourteen of its mountain ranges reaching above the altitude of 2,000 meters. The highest mountain in Romania is Moldoveanu Peak (2544 m). In south-central Romania, the Carpathians sweeten into hills, towards the BÄrÄgan Plains. Romania's geographical diversity has led to an accompanying diversity of flora and fauna. ",Moldoveanu Peak,768d_top1_persona
1365,What is the official language of Romania?,"The official language of Romania is Romanian, an Eastern Romance language related to Italian, French, Spanish, Portuguese and Catalan. Romanian is spoken as a first language by 91% of the population, with Hungarian and Romani being the most important minority languages, spoken by 6.7% and 1.1% of the population, respectively.  Until the 1990s, there was also a substantial number of German-speaking Transylvanian Saxons, even though many have since emigrated to Germany, leaving only 45,000 native German speakers in Romania. In localities where a given ethnic minority makes up more than 20% of the population, that minority's language can be used in the public administration and justice system, while native-language education and signage is also provided. English and French are the main foreign languages taught in schools. English is spoken by 5 million Romanians, French is spoken by 4-5 million, and German, Italian and Spanish are each spoken by 1-2 million people.   Outsourcing IT Ã®n RomÃ¢nia, Owners Association of the Software and Service Industry, retrieved November 13 2005  Historically, French was the predominant foreign language spoken in Romania, even though English has since superseded it. Consequently, Romanian English-speakers tend to be younger than Romanian French-speakers. Romania is, however, a full member of La Francophonie, and hosted the Francophonie Summit in 2006.   Chronology of the International Organization La Francophonie  German has been taught predominantly in Transylvania, due to traditions tracing back to the Austro-Hungarian rule in this province.",Romanian,768d_top1_persona
1367,Is the Romanian economy doing well?,"After a series of privatisations and reforms in the late 1990s and early 2000s, government intervention in the Romanian economy is somewhat lower than in other European economies.  Index of Economic Freedom: Romania  In 2005, the government replaced Romania's progressive tax system with a flat tax of 16% for both personal income and corporate profit, resulting in the country having the lowest fiscal burden in the European Union,  Taxation trends in the EU, Eurostat, 26 June 2007  a factor which has contributed to the growth of the private sector. The economy is predominantly based on services, which account for 55% of GDP, even though industry and agriculture also have significant contributions, making up 35% and 10% of GDP, respectively. Additionally, 32% of the Romanian population is employed in agriculture and primary production, one of the highest rates in Europe.  Since 2000, Romania has attracted increasing amounts of foreign investment, becoming the single largest investment destination in Southeastern and Central Europe. Foreign direct investment was valued at â¬8.3 billion in 2006.  Romania: FDI reached over EUR 8.3 bn  According to a 2006 World Bank report, Romania currently ranks 49th out of 175 economies in the ease of doing business, scoring higher than other countries in the region such as Hungary, Poland and the Czech Republic.  Economy Ranking, Doing Business 2007 Report, World Bank  Additionally, the same study judged it to be the world's second-fastest economic reformer in 2006.  Doing Business 2007 Report, World Bank  The average gross wage per month in Romania is 1411 lei as of September 2007,    Average wage in September 2007, National Institute of Statistics, Romania  equating to â¬403.3 (US$597.3) based on international exchange rates, and $1001.1 based on purchasing power parity.  Implied PPP conversion rate for Romania, IMF, 2006  The percentage of computers connected to the internet in the country reaches almost 70% and more than 50% have","The average gross wage per month in Romania is 1411 lei as of September 2007, Average wage in September 2007, National Institute of Statistics, Romania equating to â403.3 (US$597.3) based on international exchange rates, and $1001.1 based on purchasing power parity. Implied PPP conversion rate for Romania, IMF, 2006 The percentage of computers connected to the internet in the country reaches almost 70% and more than 50% have",768d_top1_persona
1368,Are there many Roma in Romania?,"According to the 2002 census, Romania has a population of 21,698,181 and, similarly to other countries in the region, is expected to gently decline in the coming years as a result of sub-replacement fertility rates. Romanians make up 89.5% of the population. The largest ethnic minorities are Hungarians, who make up 6.6% of the population and Roma, or Gypsies, who make up 2% of the population. By the official census 535,250 Roma live in Romania. 2002 census data, based on  Population by ethnicity, gives a total of 535,250 Roma in Romania. This figure is disputed by other sources, because at the local level, many Roma declare a different ethnicity (mostly Romanian, but also Hungarian in the West and Turkish in Dobruja) for fear of discrimination. Many are not recorded at all, since they   do not have ID cards. International sources give higher figures than the official census( UNDP's Regional Bureau for Europe,  World Bank,  International Association for Official Statistics).   usatoday: European effort spotlights plight of the Roma  Hungarians, who are a sizeable minority in Transylvania, constitute a majority in the counties of Harghita and Covasna. Ukrainians, Germans, Lipovans, Turks, Tatars, Serbs, Slovaks, Bulgarians, Croats, Greeks, Russians, Jews, Czechs, Poles, Italians, Armenians, as well as other ethnic groups, account for the remaining 1.4% of the population.  Official site of the results of the 2002 Census ","This figure is disputed by other sources, because at the local level, many Roma declare a different ethnicity (mostly Romanian, but also Hungarian in the West and Turkish in Dobruja) for fear of discrimination. Many are not recorded at all, since they do not have ID cards. International sources give higher figures than the official census( UNDP's Regional Bureau for Europe, World Bank, International Association for Official Statistics). usatoday: European effort spotlights plight of the Roma Hungarians, who are a sizeable minority in Transylvania, constitute a majority in the counties of Harghita and Covasna. Ukrainians, Germans, Lipovans, Turks, Tatars, Serbs, Slovaks, Bulgarians, Croats, Greeks, Russians,",768d_top1_persona
1370,How many territories joined to form Romania?,"Romania is a semi-presidential unitary state. As a nation-state, the country was formed by the merging of Moldavia and Wallachia in 1859 and it gained recognition of its independence in 1878. Later, in 1918, they were joined by Transylvania, Bukovina and Bessarabia. At the end of World War II, parts of its territories (roughly the present day Moldova) were occupied by USSR and Romania became a member of Warsaw Pact. With the fall of the Iron Curtain in 1989, Romania started a series of political and economic reforms that peaked with Romania joining the European Union.",3,768d_top1_persona
1372,Does Romania share a border with Ukraine?,"Romania ( ,  ) is a country in Southeastern Europe. It shares a border with Hungary and Serbia to the west, Ukraine and the Republic of Moldova to the northeast, and Bulgaria to the south. Romania has a stretch of sea coast along the Black Sea. It is located roughly in the lower basin of the Danube and almost all of the Danube Delta is located within its territory.","It shares a border with Hungary and Serbia to the west, Ukraine and the Republic of Moldova to the northeast, and Bulgaria to the south",768d_top1_persona
1374,Did Romania declare neutrality during World War I?,"In August 1914, when World War I broke out, Romania declared neutrality. Two years later, under the pressure of Allies (especially France desperate to open a new front), on August 14/27 1916 it joined the Allies, for which they were promised support for the accomplishment of national unity, Romania declared war on Austria-Hungary.",Yes,768d_top1_persona
1376,Does Romania share the same language with Moldova?,"Relations with Moldova are rather special, considering that the two countries practically share the same language, and a fairly common historical background. Signs in the early 1990s that Romania and Moldova might unite after both countries achieved emancipation from communist rule, quickly faded away when a pro-Russian government was formed in Moldova. Romania remains interested in Moldovan affairs, but the two countries have been unable even to reach agreement on a basic bilateral treaty; Romania is insistent (against determined Moldovan resistance) that such a treaty would have to refer to Romania and Moldova's 'special relationship'. For more information see Movement for unification of Romania and Moldova.","Romania remains interested in Moldovan affairs, but the two countries have been unable even to reach agreement on a basic bilateral treaty; Romania is insistent (against determined Moldovan resistance) that such a treaty would have to refer to Romania and Moldova's 'special relationship'",768d_top1_persona
1378,"Who was the first gymnast to score a perfect ""ten""?","In the 1976 Summer Olympics, the gymnast Nadia ComÄneci (coach: Bela Karolyi) became  the first gymnast ever to score a perfect ""ten"". She also won three gold medals, one silver and one bronze, all at the age of fifteen.  ""Gymnast Posts Perfect Mark"" Robin Herman, New York Times, March 28, 1976  Her success continued in the 1980 Summer Olympics, where she was awarded two gold medals and two silver medals.",Nadia Comneci,768d_top1_persona
1380,What is the largest city in Romania?,"There are 25 cities with a population of at least 100,000. Until now, several of the largest cities have a metropolitan area: ConstanÅ£a (550,000 people), BraÅov, IaÅi (both with around 400,000) and Oradea (260,000) and several others are planned: TimiÅoara (400,000), Cluj-Napoca (400,000), GalaÅ£i-Braila (600,000), Craiova (370,000), Bacau and PloieÅti.    ""Map of Romanian municipalities that can have metorpolitan areas in maroon""",Cluj-Napoca,768d_top1_persona
1382,What is the largest ethnic minority in Romania?,"According to the 2002 census, Romania has a population of 21,698,181 and, similarly to other countries in the region, is expected to gently decline in the coming years as a result of sub-replacement fertility rates. Romanians make up 89.5% of the population. The largest ethnic minorities are Hungarians, who make up 6.6% of the population and Roma, or Gypsies, who make up 2% of the population. By the official census 535,250 Roma live in Romania. 2002 census data, based on  Population by ethnicity, gives a total of 535,250 Roma in Romania. This figure is disputed by other sources, because at the local level, many Roma declare a different ethnicity (mostly Romanian, but also Hungarian in the West and Turkish in Dobruja) for fear of discrimination. Many are not recorded at all, since they   do not have ID cards. International sources give higher figures than the official census( UNDP's Regional Bureau for Europe,  World Bank,  International Association for Official Statistics).   usatoday: European effort spotlights plight of the Roma  Hungarians, who are a sizeable minority in Transylvania, constitute a majority in the counties of Harghita and Covasna. Ukrainians, Germans, Lipovans, Turks, Tatars, Serbs, Slovaks, Bulgarians, Croats, Greeks, Russians, Jews, Czechs, Poles, Italians, Armenians, as well as other ethnic groups, account for the remaining 1.4% of the population.  Official site of the results of the 2002 Census ",Hungarians,768d_top1_persona
1384,How many countries in Europe are bigger than Romania?  ,"Romania has been a member of the European Union since January 1 2007, and has the ninth largest territory in the EU and with 22 million people      it has the 7th largest population among the EU member states. Its capital and largest city is Bucharest (   ), the sixth largest city in the EU with almost 2.5 million people. In 2007, Sibiu, a large city in Transylvania, was chosen as European Capital of Culture.    Romania joined NATO on March 29, 2004, and is also a member of the Latin Union, of the Francophonie and of OSCE.",6,768d_top1_persona
1386,Why doesn't Romania have a state religion?  ,"Romania is a secular state, thus having no national religion. The dominant religious body is the Romanian Orthodox Church; its members make up 86.7% of the population according to the 2002 census. Other important religions include Roman Catholicism (4.7%), Protestantism (3.7%), Pentecostal denominations (1.5%) and the Romanian Greek-Catholic Church (0.9%).  Romania also has a historically significant Muslim minority concentrated in Dobrogea, mostly of Turkish ethnicity and numbering 67,500 people.     Romanian Census Website with population by religion  Based on the 2002 census data, there are also 6,179 Jews, 23,105 people who are of no religion and/or atheist, and 11,734 who refused to answer. On December 27, 2006, a new Law on Religion was approved under which religious denominations can only receive official registration if they have at least 20,000 members, or about 0.1 percent of Romania's total population.  Romania President Approves Europe's ""Worst Religion Law""","The dominant religious body is the Romanian Orthodox Church; its members make up 86.7% of the population according to the 2002 census. Other important religions include Roman Catholicism (4.7%), Protestantism (3.7%), Pentecostal denominations (1.5%) and the Romanian Greek-Catholic Church (0.9%). Romania also has a historically significant Muslim minority concentrated in Dobrogea, mostly of Turkish ethnicity and numbering 67,500 people.",768d_top1_persona
1387,Why wasn't Romania neutral during World War II?,"In August 1914, when World War I broke out, Romania declared neutrality. Two years later, under the pressure of Allies (especially France desperate to open a new front), on August 14/27 1916 it joined the Allies, for which they were promised support for the accomplishment of national unity, Romania declared war on Austria-Hungary.","Under the pressure of Allies (especially France desperate to open a new front), on August 14/27 1916 it joined the Allies, for which they were promised support for the accomplishment of national unity, Romania declared war on Austria-Hungary.",768d_top1_persona
1389,"Sibiu, a large city in Transylvania, was chosen as European Capital of Culture in what year?","Saxon medieval city of Sibiu (Nagyszeben), European Capital of Culture in 2007",2007,768d_top1_persona
1390,"What are approximately 42,000 years old and have been nicknamed`` John of Anina''?","In 2002, the oldest modern human (Homo sapiens sapiens) remains in Europe were discovered in the ""Cave With Bones"" (PeÅtera cu Oase) near Anina in present day Romania.    The remains (the lower jaw) are approximately 42,000 years old and have been nicknamed ""John of Anina"" (Ion din Anina). As Europeâs oldest remains of Homo sapiens, they may represent the first such people to have entered the continent.     The remains are especially interesting because they present a mixture of archaic, early modern human and Neanderthal morphological features.",The remains (the lower jaw),768d_top1_persona
1391,"Is it true that romania has a population of 21,698,181?","According to the 2002 census, Romania has a population of 21,698,181 and, similarly to other countries in the region, is expected to gently decline in the coming years as a result of sub-replacement fertility rates. Romanians make up 89.5% of the population. The largest ethnic minorities are Hungarians, who make up 6.6% of the population and Roma, or Gypsies, who make up 2% of the population. By the official census 535,250 Roma live in Romania. 2002 census data, based on  Population by ethnicity, gives a total of 535,250 Roma in Romania. This figure is disputed by other sources, because at the local level, many Roma declare a different ethnicity (mostly Romanian, but also Hungarian in the West and Turkish in Dobruja) for fear of discrimination. Many are not recorded at all, since they   do not have ID cards. International sources give higher figures than the official census( UNDP's Regional Bureau for Europe,  World Bank,  International Association for Official Statistics).   usatoday: European effort spotlights plight of the Roma  Hungarians, who are a sizeable minority in Transylvania, constitute a majority in the counties of Harghita and Covasna. Ukrainians, Germans, Lipovans, Turks, Tatars, Serbs, Slovaks, Bulgarians, Croats, Greeks, Russians, Jews, Czechs, Poles, Italians, Armenians, as well as other ethnic groups, account for the remaining 1.4% of the population.  Official site of the results of the 2002 Census ",yes,768d_top1_persona
1392,What do economy and law have in common?,Economy and law links,law,768d_top1_persona
1393,What did Tourism in Romania attract in 2005?,Tourism in Romania attracted â¬400 million in investments in 2005.   Archive from Gandul Newspaper - Tourism attracted in 2005 investments worth 400 million euros,â400 million in investments,768d_top1_persona
1395,Is Romania a semi-presidential unitary state?,"Romania is a semi-presidential democratic republic where executive functions are shared between the president and the prime minister.  The president is elected by popular vote, and resides at Cotroceni Palace. Since the constitutional amendment of 2003, the president's term is five years (previously it was four).  The Romanian Government, which is based at Victoria Palace, is headed by a prime minister, who appoints the other members of his or her cabinet and who is nearly always the head of the party or coalition that holds a majority in the parliament. If, however, none of the parties hold 50% + 1 of the total seats in parliament, the president will appoint the prime minister. Before beginning its term, the government is subject to a parliamentary vote of approval.",Romania is a semi-presidential democratic republic where executive functions are shared between the president and the prime minister.,768d_top1_persona
1398,Is Romania a semi-presidential democratic republic where executive functions are shared between the president and the prime minister ?,"Romania is a semi-presidential democratic republic where executive functions are shared between the president and the prime minister.  The president is elected by popular vote, and resides at Cotroceni Palace. Since the constitutional amendment of 2003, the president's term is five years (previously it was four).  The Romanian Government, which is based at Victoria Palace, is headed by a prime minister, who appoints the other members of his or her cabinet and who is nearly always the head of the party or coalition that holds a majority in the parliament. If, however, none of the parties hold 50% + 1 of the total seats in parliament, the president will appoint the prime minister. Before beginning its term, the government is subject to a parliamentary vote of approval.",Romania is a semi-presidential democratic republic where executive functions are shared between the president and the prime minister.,768d_top1_persona
1399,Was Gellu Naum the leader of the surrealist movement in Romania ?,"In the period between the two world wars, authors like Tudor Arghezi, Lucian Blaga or Ion Barbu made efforts to synchronize Romanian literature with the European literature of the time. Gellu Naum was the leader of the surrealist movement in Romania. In the Communist era, valuable writers like Nichita StÄnescu, Marin Sorescu or Marin Preda managed to escape censorship, broke with ""socialist realism"" and were the leaders of a small ""Renaissance"" in Romanian literature. ÅtefÄnescu, Alex. - ""Nichita StÄnescu, Ãngerul cu o carte Ã®n mÃ¢ini"" (Nichita StÄnescu, The Angel With A Book In His Hands""), Edit. MaÅina de scris, 1999 - pag.8 ",Gellu Naum was the leader of the surrealist movement in Romania.,768d_top1_persona
