id,question,context,answer,strategy
913,Who were the midnight judges?,"As his term was expiring, Adams appointed a series of judges, called the ""Midnight Judges"" because most of them were formally appointed days before the presidential term expired. Most of the judges were eventually unseated when the Jeffersonians abolished their offices. But John Marshall remained, and his long tenure as Chief Justice of the United States represents the most lasting influence of the Federalists, as Marshall refashioned the Constitution into a nationalizing force and established the Judicial Branch as the equal of the Executive and Legislative branches. Ferling (1992) p 409","most of them were formally appointed days before the presidential term expired. Most of the judges were eventually unseated when the Jeffersonians abolished their offices. But John Marshall remained, and his long tenure as Chief Justice of the United States represents the most lasting influence of the Federalists, as Marshall refashioned the Constitution into a nationalizing force and established the Judicial Branch as the equal of the Executive and Legislative branches.",768d_top1_persona
915,In what ways was Adams opposed by Anderw Hamilton?,"As president of the Senate, Adams cast 31 tie-breaking votesâa record that only John C. Calhoun came close to tying, with 28.  Ferling (1992) p 311  His votes protected the president's sole authority over the removal of appointees and influenced the location of the national capital. On at least one occasion, he persuaded senators to vote against legislation that he opposed, and he frequently lectured the Senate on procedural and policy matters. Adams's political views and his active role in the Senate made him a natural target for critics of the Washington administration. Toward the end of his first term, as a result of a threatened resolution that would have silenced him except for procedural and policy matters, he began to exercise more restraint.  When the two political parties formed, he joined the Federalist Party, but never got on well with its dominant leader Alexander Hamilton. Because of Adams's seniority and the need for a northern president, he was elected as the Federalist  nominee for president in 1796, over Thomas Jefferson, the leader of the opposition Democratic-Republican Party. His success was due to peace and prosperity; Washington and Hamilton had averted war with Britain by the Jay Treaty of 1795.  Ferling (1992) pp 316-32","political views and his active role in the Senate made him a natural target for critics of the Washington administration. Toward the end of his first term, as a result of a threatened resolution that would have silenced him except for procedural and policy matters, he began to exercise more restraint. When the two political parties formed, he joined the Federalist Party, but never got on well with its dominant leader Alexander Hamilton.",768d_top1_persona
916,What information did he record in his diary?,"One document states that ""[he] is reported to have some 80 trunks in different places containing transcripts and plans having to do with his experiments [...]"". Charlotte Muzar reported that there were several ""missing"" papers and property.",containing transcripts and plans having to do with his experiments [...],768d_top1_persona
918,Who was defeated for re-election in the`` Revolution of 1800'' by Thomas Jefferson?,"In the election of 1800 John Adams and his running mate, Charles Cotesworth Pinckney went against the Republican duo of Jefferson and Burr. Hamilton tried his hardest to sabotage Adams campaign in hopes of boosting Pinckney's chances of winning the presidency. In the end, Adams lost narrowly to Jefferson by 65 to 73 electoral votes.",Adams,768d_top1_persona
919,Who represented the Continental Congress in Europe?,"Congress chose Adams to represent the fledgling union in Europe in 1777, and again in 1779. On the second trip, he was appointed as minister plenipotentiary charged with the mission of negotiating a treaty of peace and a treaty of commerce with Great Britain; he went to Europe in September 1779. The French government, however, did not approve of Adamsâs appointment and subsequently, on the insistence of the French foreign minister, the Comte de Vergennes, Benjamin Franklin, Thomas Jefferson, John Jay and Henry Laurens were appointed to cooperate with Adams. In the event Jay, Adams and Franklin played the major part in the negotiations. Overruling Franklin, Jay and Adams decided not to consult with France; instead, they dealt directly with the British commissioners.  Ferling (1992) ch 11-12",Adams,768d_top1_persona
920,What is now part of Adams National Historical Park?,"Birthplace of John Adams, Quincy, Massachusetts.","Quincy, Massachusetts",768d_top1_persona
921,Is it true that adams had spent some time as the ambassador?,"In 1785, John Adams was appointed the first American minister to the Court of St. James's (that is, ambassador to Great Britain). When he was presented to his former sovereign, George III, the King intimated that he was aware of Adams's lack of confidence in the French government. Adams admitted this, stating: ""I must avow to your Majesty that I have no attachment but to my own country.â",yes,768d_top1_persona
922,Is it true that massachuS08_setts sent him in 1774?,"In December 1765, he delivered a speech before the governor and council in which he pronounced the Stamp Act invalid on the ground that Massachusetts, being without representation in Parliament, had not assented to it.  Ferling (1992) pp 53-63",no,768d_top1_persona
923,Who did MassachuS08_setts send in 1774?,"In December 1765, he delivered a speech before the governor and council in which he pronounced the Stamp Act invalid on the ground that Massachusetts, being without representation in Parliament, had not assented to it.  Ferling (1992) pp 53-63","he delivered a speech before the governor and council in which he pronounced the Stamp Act invalid on the ground that Massachusetts, being without representation in Parliament, had not assented to it",768d_top1_persona
924,"Are his last words often quoted as "" Thomas Jefferson survives "" . ?","On July 4, 1826, the 50th anniversary of the adoption of the Declaration of Independence, Adams died at his home in Quincy. His last words are often quoted as ""Thomas Jefferson survives."" Only the words ""Thomas Jefferson"" were clearly intelligible among his last, however.  Jefferson Still Survives. Retrieved on 2006-12-26.  Adams was unaware that Jefferson, his great political rival â and later friend and correspondent â had died a few hours earlier on that same day.United First Parish Church The fact that Adams and Jefferson, both of whom had been so instrumental in creating the Declaration of Independence, died on the fiftieth anniversary of the date of its publication, is one of the more remarkable coincidences in history.",Yes,768d_top1_persona
925,"The John Adams Library , housed at the Boston Public Library , contains what?","* The  John Adams Library, housed at the Boston Public Library, contains Adams's personal collection of more than 3,500 volumes in eight languages, many of which are extensively annotated by Adams.",historian and researcher,768d_top1_persona
926,Adams ' opponents were what?,"During the presidential campaign of 1796 Adams was the presidential candidate of the Federalist Party and Thomas Pinckney, the Governor of South Carolina, his running mate. The federalists wanted Adams as their presidential candidate to crush Thomas Jefferson's bid. Most federalists would have preferred Hamilton to be a candidate.  Although Hamilton and his followers supported Adams, they also held a grudge against him.  They did consider him to be the lesser of the two evils. However, they thought Adams lacked the seriousness and popularity that had caused Washington to be successful, and also feared that Adams was too vain, opinionated, unpredictable, and stubborn to follow their directions.  Adams' opponents were former Secretary of State Thomas Jefferson of Virginia, who was joined by Senator Aaron Burr of New York on the Democratic-Republican ticket.","former Secretary of State Thomas Jefferson of Virginia, who was joined by Senator Aaron Burr of New York on the Democratic-Republican ticket.",768d_top1_persona
927,"Did the election of 1800 not become a bitter and volatile battle , with each side expressing extraordinary fear of the other party and its policies ?","* Ferling, John. Adams vs. Jefferson: The Tumultuous Election of 1800. (2004), narrative history of the election .","It was a bitter and volatile battle , with each side expressing extraordinary fear of the other party and its policies .",768d_top1_persona
928,What happened in 1764?,"The Death of General Wolfe on the Plains of Abraham at Quebec in 1759, part of the Seven Years' War.",The Death of General Wolfe on the Plains of Abraham at Quebec,768d_top1_persona
929,Is a kangaroo a reptile?,Red Kangaroo (Macropus rufus),yes,768d_top1_persona
931,Is a kangaroo on the Australian coat of arms?,"The kangaroo is an Australian icon: it is featured on the Australian coat of arms,  Australia's coat of arms URL accessed January 6, 2007.  on some of its currency,  The Australian currency URL accessed January 6, 2007.  and is used by many Australian organisations, including Qantas.  The Kangaroo symbol URL accessed January 6, 2007.","It is featured on the Australian coat of arms, Australia's coat of arms URL accessed January 6, 2007. on some of its currency, The Australian currency URL accessed January 6, 2007. and is used by many Australian organisations, including Qantas. The Kangaroo symbol URL accessed January 6, 2007.",768d_top1_persona
933,"Was James Cook the first to record the name ""Kangooroo?""","The word kangaroo derives from the Guugu Yimidhirr word gangurru, referring to a grey kangaroo.  Etymology of mammal names URL accessed January 7, 2007.  The name was first recorded as ""Kangooroo or Kanguru"" on 4 August,1770, by Lieutenant (later Captain) James Cook on the banks of the Endeavour River at the site of modern Cooktown, when HM Bark Endeavour was beached for almost seven weeks to repair damage sustained on the Great Barrier Reef.","The name was first recorded as ""Kangooroo or Kanguru"" on 4 August,1770, by Lieutenant (later Captain) James Cook on the banks of the Endeavour River at the site of modern Cooktown, when HM Bark Endeavour was beached for almost seven weeks to repair damage sustained on the Great Barrier Reef.",768d_top1_persona
935,What is a collective noun for kangaroos?,There are four species that are commonly referred to as kangaroos:,kangaroos,768d_top1_persona
937,Where do joeys complete postnatal development?,"Kangaroos have developed a number of adaptations to a dry, infertile continent and highly variable climate. As with all marsupials, the young are born at a very early stage of development   after a gestation of 31 36 days. At this stage, only the forelimbs are somewhat developed, to allow the newborn to climb to the pouch and attach to a teat. In comparison, a human embryo at a similar stage of development would be about seven weeks old, and premature babies born at less than 23 weeks are usually not mature enough to survive. The joey will usually stay in the pouch for about nine months (180 320 days for the Western Grey) before starting to leave the pouch for small periods of time. It is usually fed by its mother until reaching 18 months.",pouch,768d_top1_persona
939,"What do kangaroos use for ""crawl-walking?""","Kangaroos are the only large animals to use hopping as a means of locomotion. The comfortable hopping speed for Red Kangaroo is about 20 25 km/h (13 16 mph), but speeds of up to 70 km/h (44 mph) can be attained, over short distances, while it can sustain a speed of 40 km/h (25 mph) for  nearly two kilometres.    This fast and energy-efficient method of travel has evolved because of the need to regularly cover large distances in search of food and water, rather than the need to escape predators.",hopping,768d_top1_persona
941,Why do kangaroos have a wide bite?,"Because of its grazing, kangaroos have developed specialized teeth. Its incisors are able to crop grass close to the ground, and its molars chop and grind the grass. Since the two sides of the lower jaw are not joined together, the lower incisors are farther apart, giving the kangaroo a wider bite. The silica in grass is abrasive, so kangaroo molars move forward as they are ground down, and eventually fall out, replaced by new teeth that grow in the back.","Because of its grazing, kangaroos have developed specialized teeth. Its incisors are able to crop grass close to the ground, and its molars chop and grind the grass. Since the two sides of the lower jaw are not joined together, the lower incisors are farther apart, giving the kangaroo a wider bite",768d_top1_persona
943,What is responsible for converting the hydrogen byproduct of fermentation into acetate?,"Despite having a herbivorous diet similar to ruminants such as cattle which release large quantities of methane through exhaling and eructation, kangaroos release virtually none. The hydrogen byproduct of fermentation is instead converted into acetate, which is then used to provide further energy. Scientists are interested in the possibility of transferring the bacteria responsible from kangaroos to cattle, since the greenhouse gas effect of methane is 23 times greater than that of carbon dioxide.  Radio Australia - Innovations: ",bacteria,768d_top1_persona
945,Are wild kangaroos shot for meat?,"In general, larger kangaroos have adapted much better to changes wrought to the Australian landscape by humans and though many of their smaller cousins are endangered, they are plentiful. They are not farmed to any extent, but wild kangaroos are shot for meat, over which there is controversy.  Steve Dow: ""An industry that's under the gun"". Sydney Morning Herald online, September 26, 2007.","wild kangaroos are shot for meat, over which there is controversy",768d_top1_persona
947,Have kangaroos fared well since European S08_settlement?,"Unlike many of the smaller macropods, kangaroos have fared well since European settlement. European settlers cut down forests to create vast grasslands for sheep and cattle grazing, added stock watering points in arid areas, and have substantially reduced the number of dingoes.","Unlike many of the smaller macropods, kangaroos have fared well since European settlement",768d_top1_persona
949,Do kangaroos have many natural predators?,"Kangaroos have few natural predators. The Thylacine, considered by palaeontologists to have once been a major natural predator of the kangaroo, is now extinct. Other extinct predators included the Marsupial Lion, Megalania and the Wonambi. However, with the arrival of humans in Australia at least 50,000 years ago and the introduction of the dingo about 5,000 years ago, kangaroos have had to adapt.   The mere barking of a dog can set a full-grown male boomer into a wild frenzy.   Wedge-tailed Eagles and other raptors usually eat kangaroo carrion. Goannas and other carnivorous reptiles also pose a danger to smaller kangaroo species when other food sources are lacking.",Kangaroos have few natural predators,768d_top1_persona
951,What is the average life expectancy of a kangaroo?,The average life expectancy of a kangaroo is about 4 6 years.,4 6 years,768d_top1_persona
953,When did the first official report of kangaroo blindness take place?,"Eye disease  is rare but not new among kangaroos.  The first official report of kangaroo blindness took place in 1994, in central New South Wales.  The following year, reports of blind kangaroos appeared in Victoria and South Australia.  By 1996, the disease had spread ""across the desert to Western Australia"".  Australian authorities were concerned that the disease could spread to other livestock and possibly humans.  Researchers at the Australian Animal Health Laboratories in Geelong detected a virus called the Wallal virus in two species of midge, believed to have been the carriers.       Veterinarians also discovered that less than three percent of kangaroos exposed to the virus developed blindness.",1994,768d_top1_persona
955,What are vehicles that frequent isolated roads often fitted with?,"Vehicles that frequent isolated roads, where roadside assistance may be scarce, are often fitted with ""roo bars"" to minimise damage caused by collision. Bonnet-mounted devices, designed to scare wildlife off the road with ultrasound and other methods, have been devised and marketed.",roo bars,768d_top1_persona
957,Do kangaroos eat plants?,"Different species of kangaroos eat different diets.  Eastern grey kangaroos are predominantly grazers eating a wide variety of grasses whereas some other species (e.g. red kangaroos and swamp wallabies) include significant amounts of shrubs in the diet. The smaller species of kangaroos also consume hypogeal fungi.  Many species are nocturnal  Archives URL accessed January 7, 2007.  and crepuscular,  Columbus Zoo article URL accessed January 7, 2007.  usually spending the days resting in shade and the cool evenings, nights and mornings moving about and feeding.",Different species of kangaroos eat different diets. Eastern grey kangaroos are predominantly grazers eating a wide variety of grasses whereas some other species (e.g. red kangaroos and swamp wallabies) include significant amounts of shrubs in the diet,768d_top1_persona
959,What are some extinct predators of the kangaroo?,"Kangaroos have few natural predators. The Thylacine, considered by palaeontologists to have once been a major natural predator of the kangaroo, is now extinct. Other extinct predators included the Marsupial Lion, Megalania and the Wonambi. However, with the arrival of humans in Australia at least 50,000 years ago and the introduction of the dingo about 5,000 years ago, kangaroos have had to adapt.   The mere barking of a dog can set a full-grown male boomer into a wild frenzy.   Wedge-tailed Eagles and other raptors usually eat kangaroo carrion. Goannas and other carnivorous reptiles also pose a danger to smaller kangaroo species when other food sources are lacking.","Marsupial Lion, Megalania and the Wonambi",768d_top1_persona
962,Is a Kangaroo a Marsupial?,"*Dawson, Terence J. 1995. Kangaroos: Biology of the Largest Marsupials. Cornell University Press, Ithaca, New York. Second printing: 1998. ISBN 0-8014-8262-3.",Yes,768d_top1_persona
964,Is the kangaroo an herbivour?,"Kangaroos have few natural predators. The Thylacine, considered by palaeontologists to have once been a major natural predator of the kangaroo, is now extinct. Other extinct predators included the Marsupial Lion, Megalania and the Wonambi. However, with the arrival of humans in Australia at least 50,000 years ago and the introduction of the dingo about 5,000 years ago, kangaroos have had to adapt.   The mere barking of a dog can set a full-grown male boomer into a wild frenzy.   Wedge-tailed Eagles and other raptors usually eat kangaroo carrion. Goannas and other carnivorous reptiles also pose a danger to smaller kangaroo species when other food sources are lacking.",kangaroos have few natural predators,768d_top1_persona
966,Are Kangaroos Shy?,"Kangaroos are shy and retiring by nature, and in normal circumstances present no threat to humans. Male kangaroos often ""box"" amongst each other, playfully, for dominance, or in competition for mates. The dexterity of their forepaws is utilised in both punching and grappling with the foe, but the real danger lies in a serious kick with the hindleg. The sharpened toenails can disembowel an opponent.","Kangaroos are shy and retiring by nature, and in normal circumstances present no threat to humans. Male kangaroos often ""box"" amongst each other, playfully, for dominance, or in competition for mates. The dexterity of their forepaws is utilised in both punching and grappling with the foe, but the real danger lies in a serious kick with the hindleg. The sharpened toenails can disembowel an opponent.",768d_top1_persona
968,What method of locomotion do Kangaroos Use?,"Kangaroos are the only large animals to use hopping as a means of locomotion. The comfortable hopping speed for Red Kangaroo is about 20 25 km/h (13 16 mph), but speeds of up to 70 km/h (44 mph) can be attained, over short distances, while it can sustain a speed of 40 km/h (25 mph) for  nearly two kilometres.    This fast and energy-efficient method of travel has evolved because of the need to regularly cover large distances in search of food and water, rather than the need to escape predators.",hopping,768d_top1_persona
972,What is a collective noun for a kangaroo?,There are four species that are commonly referred to as kangaroos:,kangaroo,768d_top1_persona
974,What is a roo?,"Kangaroo soon became adopted into standard English where it has come to mean any member of the family of kangaroos and wallabies.  Male kangaroos are called bucks, boomers, jacks, or old men; females are does, flyers, or jills, and the young ones are joeys.  Animal Bytes: Kangaroo and Wallaby URL accessed January 7, 2007.  The collective noun for kangaroos is a mob, troop, or court. Kangaroos are sometimes colloquially referred to as roos.",Kangaroos are sometimes colloquially referred to as roos.,768d_top1_persona
976,What is used to protect a vehicale from a Kangaroo?,"A collision with a vehicle is capable of killing a kangaroo. Kangaroos dazzled by headlights or startled by engine noise have been known to leap in front of cars.  Since kangaroos in mid-bound can reach speeds of around 50 km/h (31 mph) and are relatively heavy, the force of impact can be severe.  Small vehicles may be destroyed, while larger vehicles may suffer engine damage. The risk of harm to vehicle occupants is greatly increased if the windscreen is the point of impact.  As a result, ""kangaroo crossing"" signs are commonplace in Australia.",windscreen,768d_top1_persona
978,What method is used by Kangaroos to travel?,"Kangaroos are the only large animals to use hopping as a means of locomotion. The comfortable hopping speed for Red Kangaroo is about 20 25 km/h (13 16 mph), but speeds of up to 70 km/h (44 mph) can be attained, over short distances, while it can sustain a speed of 40 km/h (25 mph) for  nearly two kilometres.    This fast and energy-efficient method of travel has evolved because of the need to regularly cover large distances in search of food and water, rather than the need to escape predators.",hopping,768d_top1_persona
979,Who asked a nearby local what the creatures were called?,"A common myth about the kangaroo's English name is that it came from the Aboriginal words for ""I don't understand you."" According to this legend, Captain James Cook and naturalist Sir Joseph Banks were exploring Australia when they happened upon the animal. They asked a nearby local what the creatures were called. The local responded ""Kangaroo"", meaning ""I don't understand you"", which Cook took to be the name of the creature.  Tour lecture,  , Dawsonville, GA. ",Captain James Cook and naturalist Sir Joseph Banks,768d_top1_persona
980,What are four species that are commonly referred to as kangaroos?,There are four species that are commonly referred to as kangaroos:,kangaroos,768d_top1_persona
981,Are kangaroos and wallabies adept swimmers?,"Along with dingos and other canids, introduced species like foxes and feral cats also pose a threat to kangaroo populations. Kangaroos and wallabies are adept swimmers, and often flee into waterways if presented with the option. If pursued into the water, a large kangaroo may use its forepaws to hold the predator underwater so as to drown it.  Canadian Museum of Nature - Kangaroo URL accessed January 6, 2007.  Another defensive tactic described by witnesses is catching the attacking dog  with the forepaws and disembowelling it with the hind legs.",Kangaroos and wallabies are adept swimmers,768d_top1_persona
982,Are kangaroos farmed to any extent?,"In general, larger kangaroos have adapted much better to changes wrought to the Australian landscape by humans and though many of their smaller cousins are endangered, they are plentiful. They are not farmed to any extent, but wild kangaroos are shot for meat, over which there is controversy.  Steve Dow: ""An industry that's under the gun"". Sydney Morning Herald online, September 26, 2007.",They are not farmed to any extent,768d_top1_persona
983,Who also discovered that less than three percent of kangaroos exposed to the virus developed blindness ?,"Eye disease  is rare but not new among kangaroos.  The first official report of kangaroo blindness took place in 1994, in central New South Wales.  The following year, reports of blind kangaroos appeared in Victoria and South Australia.  By 1996, the disease had spread ""across the desert to Western Australia"".  Australian authorities were concerned that the disease could spread to other livestock and possibly humans.  Researchers at the Australian Animal Health Laboratories in Geelong detected a virus called the Wallal virus in two species of midge, believed to have been the carriers.       Veterinarians also discovered that less than three percent of kangaroos exposed to the virus developed blindness.",Veterinarians,768d_top1_persona
